{
  "schema": "chain/v1",
  "run_id": "run_7d3f0a1b2c4d5e6f",
  "streams": {
    "events": {
      "genesis": "sha256:0101010101010101010101010101010101010101010101010101010101010101",
      "head": "sha256:0202020202020202020202020202020202020202020202020202020202020202",
      "count": 4321
    },
    "decisions": {
      "genesis": "sha256:0303030303030303030303030303030303030303030303030303030303030303",
      "head": "sha256:0404040404040404040404040404040404040404040404040404040404040404",
      "count": 480
    }
  },
  "files": {
    "manifest.json": "sha256:0505050505050505050505050505050505050505050505050505050505050505",
    "agent_manifest.json": "sha256:ff66ff66ff66ff66ff66ff66ff66ff66ff66ff66ff66ff66ff66ff66ff66ff66",
    "ledger.jsonl": "sha256:0606060606060606060606060606060606060606060606060606060606060606",
    "ledger_stress_2x.jsonl": "sha256:0707070707070707070707070707070707070707070707070707070707070707",
    "metrics.json": "sha256:0808080808080808080808080808080808080808080808080808080808080808",
    "chain.jsonl": "sha256:0909090909090909090909090909090909090909090909090909090909090909"
  },
  "blobs": {
    "observations": {
      "count": 480
    },
    "raw": {
      "count": 492
    }
  },
  "complete": true,
  "root": "sha256:0a0a0a0a0a0a0a0a0a0a0a0a0a0a0a0a0a0a0a0a0a0a0a0a0a0a0a0a0a0a0a0a"
}
